{"assessment":{"any_funding_bulk_advertised":false,"contract_funding_bulk_advertised":false,"contract_mark_price_bulk_advertised":false,"contract_trade_bulk_advertised":true,"contract_trade_bulk_compatible_with_policy":false,"funding_product_ids":[],"granularity_policy":"one-minute-only","option_mark_price_bulk_advertised":true,"required_rest_datasets":["linear-contract-trade-price-1m","linear-contract-mark-price-1m","funding"],"semantics":"V1 accepts canonical one-minute candles and funding only. The advertised contract trade product contains tick-level public trades, so it is incompatible with this source policy. Trade-price 1m, mark-price 1m, and funding are planned from versioned public V5 REST endpoints unless Bybit later advertises a verified one-minute bulk product.","tick_data_downloaded":false,"tick_data_retained":false},"catalog":{"product_count":5,"products":[{"business_types":["contract"],"category":"quote","description":"Bybit history index price kline data","intervals":["daily"],"name":"Index Price Kline","period_count":0,"product_id":"index_price_kline"},{"business_types":["option"],"category":"quote","description":"Bybit history mark price kline data","intervals":["daily"],"name":"Mark Price Kline","period_count":0,"product_id":"mark_kline"},{"business_types":["contract","option","spot"],"category":"ob","description":"Bybit history orderBook data","intervals":["daily"],"name":"OrderBook","period_count":0,"product_id":"orderbook"},{"business_types":["contract"],"category":"quote","description":"Bybit history premium index price kline data","intervals":["daily"],"name":"Premium Index Price Kline","period_count":0,"product_id":"premium_index_kline"},{"business_types":["contract","option","spot"],"category":"trade","description":"Bybit public trading history data","intervals":[],"name":"Public Trading History","period_count":0,"product_id":"trade"}]},"command":"'C:\\VV\\PyMoneyMaker\\brullik-bybit-grid-bot-research\\.venv\\Scripts\\grid-data' history-source-assessment-1m --instrument-inventory benchmarks/results/m1-owner-storage-review-inventory-20260812.json --output benchmarks/results/m1-bybit-one-minute-source-assessment-20260812.json","content_sha256":"a43fc26400b4734cefc02a87ee11f0748f8e376af6c44b9623e26f71cfb895f4","evidence_schema":"grid.bybit-history-source-assessment/v2","fetched_at_utc":"2026-08-12T13:57:58.691355Z","inventory_backfill_estimate":{"combined_requests":{"conservative_60m_funding_interval":1845401,"current_funding_intervals":1785544},"conservative_observed_minimum_funding_interval":{"estimated_events":14751384,"estimated_requests":74261,"interval_minutes":60},"current_interval_funding":{"estimated_events":2773444,"estimated_requests":14404},"horizon_end_ms":1786538209032,"horizon_start_ms":1470968689032,"instruments_with_observed_duration":1010,"mark_price_1m":{"estimated_requests":885570,"estimated_rows":885053361},"observed_funding_interval_counts":{"120":2,"240":495,"480":502,"60":11},"request_only_seconds":{"conservative_60m_funding_interval":{"at_default_ip_limit":15379,"at_planning_10_per_second":184541},"current_funding_intervals":{"at_default_ip_limit":14880,"at_planning_10_per_second":178555}},"status_counts":{"Closed":303,"PreLaunch":5,"Trading":702},"trade_price_1m":{"estimated_requests":885570,"estimated_rows":885053361},"usdt_linear_perpetual_records":1010},"inventory_source":{"artifact":"m1-owner-storage-review-inventory-20260812.json","artifact_sha256":"f679091e55fbc7b7d1c650fc64fc907b6ec608c6b87d91ed851891073366a78a","evidence_schema":"grid.bybit-public-inventory/v1","fetched_at_utc":"2026-08-12T12:36:49.032806Z","inventory_status":"partial"},"limitations":["The frontend catalog endpoint is public and official but is not a versioned V5 API contract.","Catalog absence proves not-advertised-at-observation-time, not permanent nonexistence.","The current inventory is partial and omits historical symbols absent from the snapshot.","Current funding intervals and lifecycle fields are not dated historical metadata.","Lifecycle minutes estimate request capacity; they do not prove that REST returns complete history for every interval.","Request-only time excludes latency, throttling headroom, retry, validation, and publication.","This assessment downloads no candle, funding, or tick rows and does not authorize Phase 2."],"owner_decision":{"adr":"ADR-0016","decision_id":"D-019","recorded_date":"2026-08-12"},"source_policy":{"funding":{"endpoint":"/v5/market/funding/history","page_limit":200,"source_type":"public-rest"},"mark_price_1m":{"endpoint":"/v5/market/mark-price-kline","interval":"1","page_limit":1000,"source_type":"public-rest"},"trade_price_1m":{"endpoint":"/v5/market/kline","interval":"1","page_limit":1000,"source_type":"public-rest"}},"sources":{"catalog_endpoint":"https://api2.bybit.com/quote/public/support/download/list-products","funding_history_documentation":"https://bybit-exchange.github.io/docs/v5/market/history-fund-rate","historical_data_page":"https://www.bybit.com/en/derivative-activity/history-data","mark_price_documentation":"https://bybit-exchange.github.io/docs/v5/market/mark-kline","rate_limit_documentation":"https://bybit-exchange.github.io/docs/v5/rate-limit","trade_price_documentation":"https://bybit-exchange.github.io/docs/v5/market/kline"},"status":"owner-approved-one-minute-rest-capacity-bounded","theoretical_rest_envelope":{"combined_requests":7671300,"funding":{"estimated_events":61361300,"estimated_requests":307300,"interval_minutes":60,"page_limit":200},"instrument_count":700,"instrument_minutes_per_candle_dataset":3681644400,"mark_price_1m":{"estimated_requests":3682000,"page_limit":1000,"rows":3681644400},"minimum_request_only_seconds_at_default_ip_limit":63928,"planning_request_only_seconds_at_10_per_second":767130,"trade_price_1m":{"estimated_requests":3682000,"page_limit":1000,"rows":3681644400}}}
